{
  "$schema": "https://json-schema.org/draft/2020-12/schema",
  "$id": "https://memory-engine.local/models/v0/model-config.schema.json",
  "title": "ModelConfig",
  "description": "One entry in the model registry: what to load, how to feed it, and how to read what comes out.",
  "$comment": "OWNERSHIP: Claude owns registry contents (these files), Codex owns the loader in workers/ml-runtime. The format is therefore a cross-boundary interface and is validated in CI on both sides.\n\n WHY PRE/POST-PROCESSING IS PART OF THE REGISTRY AND NOT THE RUNTIME CODE:\n a model swap that silently changes normalisation changes every score in the library, and nothing about it looks like a bug. It looks like the taste model drifting. Pinning the exact input size, colour order, mean/std and output layout next to the weights hash means a swap is a diff, and a wrong swap fails a golden test rather than quietly degrading a year of rankings.\n\n LICENCE STATUS IS REQUIRED ON EVERY ENTRY. A model may be loaded for development while its licence is unresolved -- that is a legitimate stage -- but the registry has to say so, so that 'we will deal with licensing later' stays a decision someone can act on rather than something that ships by forgetting.",

  "type": "object",
  "additionalProperties": false,
  "required": [
    "config_version",
    "model_id",
    "version",
    "task",
    "weights",
    "runtime_targets",
    "preprocessing",
    "outputs",
    "license",
    "rollout"
  ],
  "properties": {
    "config_version": { "type": "string", "const": "v0" },

    "model_id": {
      "description": "Stable slug. Matches ModelRef.model_id in the contract, so a score can be traced to the exact registry entry that produced it.",
      "type": "string",
      "pattern": "^[a-z0-9][a-z0-9_-]{0,63}$"
    },

    "version": { "type": "string", "minLength": 1 },

    "task": {
      "type": "string",
      "enum": [
        "image_embedding",
        "face_detection",
        "face_embedding",
        "face_landmarks",
        "face_attributes",
        "technical_iqa",
        "aesthetic",
        "shot_detection",
        "optical_flow",
        "audio_embedding",
        "audio_events",
        "speech_to_text",
        "diarization",
        "beat_tracking",
        "segmentation",
        "saliency",
        "ocr",
        "safety_classifier"
      ]
    },

    "description": { "type": "string" },

    "weights": { "$ref": "#/$defs/Weights" },

    "runtime_targets": {
      "description": "Execution providers this entry is known to work on, best first. The loader picks the first available. Listing a target is a claim that it has been run, not that it ought to work.",
      "type": "array",
      "minItems": 1,
      "items": {
        "type": "string",
        "enum": [
          "onnxruntime_coreml",
          "onnxruntime_cuda",
          "onnxruntime_directml",
          "onnxruntime_cpu",
          "ctranslate2",
          "mlx",
          "llama_cpp",
          "opencv",
          "librosa",
          "native"
        ]
      }
    },

    "preprocessing": { "$ref": "#/$defs/Preprocessing" },
    "postprocessing": {
      "oneOf": [{ "$ref": "#/$defs/Postprocessing" }, { "type": "null" }]
    },

    "outputs": {
      "description": "Every output tensor, named and shaped. The loader binds by name; a model whose output names change is a different entry, not the same one upgraded.",
      "type": "array",
      "minItems": 1,
      "items": { "$ref": "#/$defs/OutputSpec" }
    },

    "batching": {
      "oneOf": [{ "$ref": "#/$defs/Batching" }, { "type": "null" }]
    },

    "license": { "$ref": "#/$defs/LicenseStatus" },
    "rollout": { "$ref": "#/$defs/Rollout" },

    "eval": {
      "oneOf": [{ "$ref": "#/$defs/EvalScores" }, { "type": "null" }]
    },

    "notes": { "type": "string" }
  },

  "$defs": {
    "Weights": {
      "title": "Weights",
      "type": "object",
      "additionalProperties": false,
      "required": ["filename", "format", "source_url", "blake3"],
      "properties": {
        "filename": { "type": "string", "minLength": 1 },
        "format": {
          "type": "string",
          "enum": ["onnx", "coreml", "ctranslate2", "gguf", "safetensors", "pytorch", "dat", "other"]
        },
        "source_url": {
          "description": "Where the weights come from. Required even while unpinned, so the audit and the download are the same fact.",
          "type": "string",
          "minLength": 1
        },
        "blake3": {
          "description": "Hash of the exact bytes. Null means UNPINNED: the file has not been downloaded and hashed yet, so this entry is not reproducible and must not be promoted past `candidate`. 'The same version' of a HuggingFace repo has had its weights changed underneath people before.",
          "oneOf": [{ "type": "string", "pattern": "^[0-9a-f]{64}$" }, { "type": "null" }]
        },
        "byte_size": {
          "oneOf": [{ "type": "integer", "minimum": 0 }, { "type": "null" }]
        },
        "quantization": {
          "type": "string",
          "enum": ["fp32", "fp16", "bf16", "int8", "int4"],
          "default": "fp32"
        }
      }
    },

    "Preprocessing": {
      "title": "Preprocessing",
      "description": "Exactly how a proxy becomes a tensor. Every field here changes model output, and a mismatch is silent -- the model still returns plausible numbers.",
      "type": "object",
      "additionalProperties": false,
      "required": ["kind"],
      "properties": {
        "kind": {
          "type": "string",
          "enum": ["image", "image_sequence", "face_crop", "audio", "none"]
        },
        "input_name": { "type": "string" },
        "input_size": {
          "oneOf": [
            {
              "type": "object",
              "additionalProperties": false,
              "required": ["width", "height"],
              "properties": {
                "width": { "type": "integer", "exclusiveMinimum": 0 },
                "height": { "type": "integer", "exclusiveMinimum": 0 }
              }
            },
            { "type": "null" }
          ]
        },
        "resize": {
          "type": "string",
          "enum": ["stretch", "letterbox", "center_crop", "shortest_side", "none"],
          "default": "stretch"
        },
        "interpolation": {
          "type": "string",
          "enum": ["bilinear", "bicubic", "lanczos", "nearest", "area"],
          "default": "bilinear"
        },
        "color_order": {
          "description": "RGB vs BGR is the single most common silent preprocessing bug. InsightFace models want BGR; almost everything else wants RGB.",
          "type": "string",
          "enum": ["rgb", "bgr", "gray"],
          "default": "rgb"
        },
        "layout": {
          "type": "string",
          "enum": ["nchw", "nhwc", "ncl", "nl"],
          "default": "nchw"
        },
        "scale": {
          "description": "Multiplier applied before mean subtraction, e.g. 1/255 for models expecting [0,1].",
          "type": "number",
          "default": 1.0
        },
        "mean": {
          "type": "array",
          "items": { "type": "number" },
          "default": []
        },
        "std": {
          "type": "array",
          "items": { "type": "number" },
          "default": []
        },
        "face_alignment": {
          "description": "For face_crop inputs: the canonical landmark template the crop is warped onto. Alignment is not optional for recognition -- an unaligned crop produces an embedding that is confidently wrong.",
          "oneOf": [{ "$ref": "#/$defs/FaceAlignment" }, { "type": "null" }]
        },
        "audio": {
          "oneOf": [{ "$ref": "#/$defs/AudioPreprocessing" }, { "type": "null" }]
        },
        "sequence_length": {
          "description": "For image_sequence models such as shot detection.",
          "oneOf": [{ "type": "integer", "exclusiveMinimum": 0 }, { "type": "null" }]
        }
      }
    },

    "FaceAlignment": {
      "title": "FaceAlignment",
      "type": "object",
      "additionalProperties": false,
      "required": ["template", "output_size", "landmark_scheme"],
      "properties": {
        "template": {
          "description": "Destination landmark coordinates in the aligned crop, in pixels. A similarity transform maps the detected landmarks onto these.",
          "type": "array",
          "minItems": 5,
          "items": {
            "type": "array",
            "minItems": 2,
            "maxItems": 2,
            "items": { "type": "number" }
          }
        },
        "output_size": {
          "type": "object",
          "additionalProperties": false,
          "required": ["width", "height"],
          "properties": {
            "width": { "type": "integer", "exclusiveMinimum": 0 },
            "height": { "type": "integer", "exclusiveMinimum": 0 }
          }
        },
        "landmark_scheme": {
          "type": "string",
          "enum": ["insightface_5", "insightface_106", "mediapipe_468", "dlib_5", "dlib_68"]
        }
      }
    },

    "AudioPreprocessing": {
      "title": "AudioPreprocessing",
      "type": "object",
      "additionalProperties": false,
      "required": ["sample_rate", "channels"],
      "properties": {
        "sample_rate": { "type": "integer", "exclusiveMinimum": 0 },
        "channels": { "type": "integer", "minimum": 1 },
        "feature": {
          "type": "string",
          "enum": ["waveform", "log_mel", "mfcc", "stft"],
          "default": "waveform"
        },
        "n_mels": { "oneOf": [{ "type": "integer", "exclusiveMinimum": 0 }, { "type": "null" }] },
        "window_seconds": {
          "oneOf": [{ "type": "number", "exclusiveMinimum": 0 }, { "type": "null" }]
        },
        "hop_seconds": {
          "oneOf": [{ "type": "number", "exclusiveMinimum": 0 }, { "type": "null" }]
        }
      }
    },

    "Postprocessing": {
      "title": "Postprocessing",
      "type": "object",
      "additionalProperties": false,
      "properties": {
        "steps": {
          "description": "Ordered. `l2_normalize` on an embedding is required, not cosmetic: every VectorSpace in the contract stores normalised vectors and cosine distance assumes it.",
          "type": "array",
          "items": {
            "type": "string",
            "enum": [
              "l2_normalize",
              "softmax",
              "sigmoid",
              "nms",
              "distance2bbox",
              "distance2kps",
              "argmax",
              "scale_to_unit",
              "clip",
              "decode_ctc"
            ]
          },
          "default": []
        },
        "nms_threshold": {
          "oneOf": [{ "type": "number", "minimum": 0, "maximum": 1 }, { "type": "null" }]
        },
        "score_threshold": {
          "oneOf": [{ "type": "number", "minimum": 0, "maximum": 1 }, { "type": "null" }]
        },
        "strides": {
          "description": "Feature-map strides for anchor-based detectors.",
          "type": "array",
          "items": { "type": "integer", "exclusiveMinimum": 0 },
          "default": []
        },
        "normalisation": {
          "description": "How a raw model score becomes the [0,1] Unit the contract stores. Required wherever a Score is written, because fusion must never need to know a model's native range.",
          "oneOf": [{ "$ref": "#/$defs/ScoreNormalisation" }, { "type": "null" }]
        }
      }
    },

    "ScoreNormalisation": {
      "title": "ScoreNormalisation",
      "type": "object",
      "additionalProperties": false,
      "required": ["method"],
      "properties": {
        "method": {
          "type": "string",
          "enum": ["identity", "min_max", "sigmoid", "linear_rescale", "percentile_calibrated"]
        },
        "input_range": {
          "oneOf": [
            {
              "type": "array",
              "minItems": 2,
              "maxItems": 2,
              "items": { "type": "number" }
            },
            { "type": "null" }
          ]
        },
        "calibration_note": { "type": "string" }
      }
    },

    "OutputSpec": {
      "title": "OutputSpec",
      "type": "object",
      "additionalProperties": false,
      "required": ["name", "meaning"],
      "properties": {
        "name": { "type": "string", "minLength": 1 },
        "meaning": {
          "type": "string",
          "enum": [
            "embedding",
            "score",
            "scores",
            "bboxes",
            "keypoints",
            "landmarks",
            "logits",
            "mask",
            "text",
            "frame_predictions"
          ]
        },
        "shape": {
          "description": "Dimensions, with -1 for dynamic. Documented so a shape change is caught at load rather than producing garbage downstream.",
          "type": "array",
          "items": { "type": "integer" },
          "default": []
        },
        "dimensions": {
          "description": "For embeddings: the vector width. Must match the VectorSpace it is written into.",
          "oneOf": [{ "type": "integer", "exclusiveMinimum": 0 }, { "type": "null" }]
        },
        "vector_space": {
          "description": "Which contract VectorSpace this embedding belongs to. Two vectors are only comparable when this matches exactly, including the model version.",
          "oneOf": [{ "type": "string" }, { "type": "null" }]
        }
      }
    },

    "Batching": {
      "title": "Batching",
      "type": "object",
      "additionalProperties": false,
      "properties": {
        "supported": { "type": "boolean", "default": true },
        "max_batch": { "type": "integer", "minimum": 1, "default": 8 },
        "dynamic_axes": { "type": "boolean", "default": true }
      }
    },

    "LicenseStatus": {
      "title": "LicenseStatus",
      "description": "Required on every entry. A model may be used in development with an unresolved licence -- that is a real stage of a real project -- but the registry must say so out loud, so deferring the decision stays a decision rather than an omission.",
      "type": "object",
      "additionalProperties": false,
      "required": ["code_license", "weights_license", "commercial_use", "verified"],
      "properties": {
        "code_license": { "type": "string", "minLength": 1 },
        "weights_license": {
          "description": "Separate from the code licence on purpose. This is the field that catches InsightFace: MIT code, non-commercial weights.",
          "type": "string",
          "minLength": 1
        },
        "commercial_use": {
          "type": "string",
          "enum": ["permitted", "prohibited", "unresolved", "requires_license_purchase"]
        },
        "verified": {
          "description": "True only when a human read the current licence at the source and recorded the date. Never set by inference.",
          "type": "boolean"
        },
        "verified_at": {
          "oneOf": [{ "type": "string", "format": "date" }, { "type": "null" }]
        },
        "license_url": {
          "oneOf": [{ "type": "string" }, { "type": "null" }]
        },
        "training_data": {
          "description": "Dataset provenance. A permissively-licensed model can still be trained on a retracted dataset (MS-Celeb-1M, VGGFace2), which is a separate exposure from the model licence and is invisible unless recorded here.",
          "oneOf": [{ "type": "string" }, { "type": "null" }]
        },
        "blocks_commercial_release": {
          "description": "True when shipping commercially with this entry would be a licence violation. The build can use it; a commercial release must not. Checked in tests.",
          "type": "boolean",
          "default": false
        },
        "note": { "type": "string" }
      }
    },

    "Rollout": {
      "title": "Rollout",
      "type": "object",
      "additionalProperties": false,
      "required": ["state"],
      "properties": {
        "state": {
          "description": "`candidate` is unproven, `shadow` runs alongside the default and is diffed, `default` is live, `deprecated` is retained only to reproduce old records.",
          "type": "string",
          "enum": ["candidate", "shadow", "default", "deprecated"]
        },
        "replaces": {
          "oneOf": [{ "type": "string" }, { "type": "null" }]
        },
        "promoted_at": {
          "oneOf": [{ "type": "string", "format": "date" }, { "type": "null" }]
        }
      }
    },

    "EvalScores": {
      "title": "EvalScores",
      "type": "object",
      "additionalProperties": false,
      "properties": {
        "benchmark": { "type": "string" },
        "metrics": {
          "type": "object",
          "additionalProperties": { "type": "number" }
        },
        "measured_at": {
          "oneOf": [{ "type": "string", "format": "date" }, { "type": "null" }]
        },
        "note": { "type": "string" }
      }
    }
  }
}
