{
  "config_version": "v0",
  "model_id": "laion-aesthetic-v2",
  "version": "2.0.0",
  "task": "aesthetic",
  "description": "Linear aesthetic head over an image embedding. Explicitly a PRIOR: the ranking engine reweights it per user from PrefEvents, so it must never be treated as ground truth.",
  "weights": {
    "filename": "aesthetic_head_v2.onnx",
    "format": "onnx",
    "source_url": "https://github.com/LAION-AI/aesthetic-predictor",
    "blake3": null,
    "byte_size": null,
    "quantization": "fp32"
  },
  "runtime_targets": [
    "onnxruntime_cpu",
    "onnxruntime_coreml"
  ],
  "preprocessing": {
    "kind": "none",
    "input_name": "embedding",
    "input_size": null,
    "resize": "none",
    "interpolation": "bilinear",
    "color_order": "rgb",
    "layout": "nl",
    "scale": 1.0,
    "mean": [],
    "std": [],
    "face_alignment": null,
    "audio": null,
    "sequence_length": null
  },
  "postprocessing": {
    "steps": [
      "scale_to_unit"
    ],
    "nms_threshold": null,
    "score_threshold": null,
    "strides": [],
    "normalisation": {
      "method": "linear_rescale",
      "input_range": [
        1.0,
        10.0
      ],
      "calibration_note": "Head emits a 1-10 rating. Rescaled linearly to [0,1] for the contract's Unit; raw_value is retained on the Score so a recalibration needs no re-run."
    }
  },
  "outputs": [
    {
      "name": "score",
      "meaning": "score",
      "shape": [
        -1,
        1
      ],
      "dimensions": null,
      "vector_space": null
    }
  ],
  "batching": {
    "supported": true,
    "max_batch": 256,
    "dynamic_axes": true
  },
  "license": {
    "code_license": "MIT",
    "weights_license": "MIT",
    "commercial_use": "permitted",
    "verified": false,
    "verified_at": null,
    "license_url": "https://github.com/LAION-AI/aesthetic-predictor",
    "training_data": "LAION aesthetics human ratings.",
    "blocks_commercial_release": false,
    "note": "Desk assessment only."
  },
  "rollout": {
    "state": "candidate",
    "replaces": null,
    "promoted_at": null
  },
  "eval": null,
  "notes": "Consumes an embedding, not pixels, so it is nearly free once SigLIP has run -- which is why the pipeline orders embedding before aesthetic. The original head was trained on CLIP ViT-L/14 features; running it on SigLIP 2 features requires retraining the linear head, and until that is done this entry is a placeholder for the shape of the config rather than a working model."
}
